,num,long_title,status,author
577,SBN-576,"an act requiring land, air, and sea transport providers to provide priority seating for the elderly, further amending for this purpose republic act no. 7432, as amended by republic act no. 9257 and 9994, otherwise known as the 'expanded senior citizen's act of 2010'",Pending in the Committee,"Poe, Grace"
579,SBN-574,"an act to lower the price of electricity by exempting its sale by generation, transmission and distribution companies and electricity cooperatives from the imposition of value added tax, amending for the purpose, sections 108 (a) and 109 (1) of the national internal revenue code, as amended by republic act no. 9337, and for other purposes",Pending in the Committee,"Poe, Grace"
580,SBN-573,"an act providing for comprehensive atomic regulation, creating for the purpose the philippine atomic regulatory commission, and appropriating funds therefor",Pending in the Committee,"Sotto III, Vicente C."
582,SBN-571,"an act prohibiting a ‘no permit, no exam’ policy or any such policy that prevents students of any educational institution from taking their examinations due to unpaid tuition and other school fees",Pending in the Committee,"Binay, Maria Lourdes Nancy S."
583,SBN-570,"an act increasing the monthly social pension of senior citizens and expanding the coverage thereof, amending for the purpose sections 2 and 5 of republic act no. 7432, as amended by republic act no. 9257, further amended by republic act no. 9994, otherwise known as the 'expanded senior citizens act of 2010'",Pending in the Committee,"Binay, Maria Lourdes Nancy S., De Lima, Leila M."
586,SBN-567,"an act granting fiscal incentives to media entities devoting airtime and space to educational programs for children, and to advertisers or sponsors supporting such programs, and for other purposes",Pending in the Committee,"Binay, Maria Lourdes Nancy S."
587,SBN-566,an act providing benefits and incentives to overseas filipino workers investing in business in the philippines,Pending in the Committee,"Binay, Maria Lourdes Nancy S."
588,SBN-565,"an act improving access of persons with disability to public and private facilities, amending for the purpose republic act no. 7277 otherwise known as the magna carta for disabled persons",Pending in the Committee,"Binay, Maria Lourdes Nancy S., De Lima, Leila M."
589,SBN-564,an act providing for the magna carta of the out-of-school youth,Pending in the Committee,"Binay, Maria Lourdes Nancy S."
591,SBN-562,an act instituting the comprehensive policy for the nursing profession in the philippines amending for this purpose republic act no. 9173 otherwise known as 'the philippine nursing act of 2002',Pending in the Committee,"Gordon, Richard J."
592,SBN-561,"an act creating a system of partnership between local governments and civil society organizations through the establishment of a people's council in every local government unit, prescribing its powers and functions",Pending in the Committee,"Drilon, Franklin M."
593,SBN-560,"an act penalizing the imposition of a 'no permit, no exam' policy or any such policy that prohibits students in all educational institutions from taking their periodic, prelims, midterm or final examinations due to unpaid tuition and other school fees",Pending in the Committee,"Pacquiao, Emmanuel ""Manny"" D."
594,SBN-559,an act providing a framework for the right to adequate food,Pending in the Committee,"Pacquiao, Emmanuel ""Manny"" D."
595,SBN-558,an act institutionalizing the philippine national games and appropriating funds therefor,Pending in the Committee,"Pacquiao, Emmanuel ""Manny"" D."
597,SBN-556,"an act empowering the philippine institute of traditional and complementary health care by vesting upon it regulatory powers, providing it with augmented human resources and upgraded equipment, establishing testing laboratories and field offices, amending certain sections of republic act no. 8423 and appropriating funds therefor",Pending in the Committee,"Pacquiao, Emmanuel ""Manny"" D."
598,SBN-555,"an act converting the siargao district hospital in the province of surigao del norte into a level 3 general hospital to be known as the 'siargao island medical center,' and appropriating funds therefor",Pending in the Committee,"Pacquiao, Emmanuel ""Manny"" D."
600,SBN-553,"an act establishing a technical education and skills development authority (tesda) manpower development institute (mdi) in soccsksargen region, and appropriating funds therefor",Pending in the Committee,"Pacquiao, Emmanuel ""Manny"" D."
601,SBN-552,an act providing internet safety and protection for children,Pending in the Committee,"Pacquiao, Emmanuel ""Manny"" D."
604,SBN-549,"an act providing the enabling mechanisms for research and development (r&d) of coconut sugar in the country, appropriating funds therefor and for other purposes",Pending in the Committee,"Lapid, Manuel ""Lito"" M."
605,SBN-548,"an act to promote the production, processing, marketing and distribution of philippine mangoes providing funds therefor, and for other purposes",Pending in the Committee,"Lapid, Manuel ""Lito"" M."
608,SBN-545,an act synchronizing the opening of all classes in all schools in the philippines,Pending in the Committee,"Zubiri, Juan Miguel ""Migz"" F."
610,SBN-543,"an act establishing quality standards for mineral, carbonated and other bottled water",Pending in the Committee,"Zubiri, Juan Miguel ""Migz"" F."
612,SBN-541,an act regulating electronic cigarettes,Pending in the Committee,"Zubiri, Juan Miguel ""Migz"" F."
613,SBN-540,"an act instituting inclusive education through the establishment of inclusive education learning resource centers for children and youth with special needs in all public schools division, providing for standards and guidelines, and appropriating funds therefor",Pending in the Committee,"Zubiri, Juan Miguel ""Migz"" F."
614,SBN-539,"an act exempting government officials and employees from the prohibition against disclosure of or inquiry into deposits with any banking institution, amending for the purpose certain provisions of republic act no. 1405, otherwise known as the ‘secrecy of bank deposits law’",Pending in the Committee,"Zubiri, Juan Miguel ""Migz"" F."
616,SBN-537,"an act classifying the sale or importation of petroleum products and raw materials in the manufacture thereof as value-added tax exempt transactions, amending for the purpose section 109 (1) of the national internal revenue code of 1997, as amended, and for other purposes",Pending in the Committee,"Zubiri, Juan Miguel ""Migz"" F."
619,SBN-534,an act providing for the protection of financial consumers and for other purposes,Pending in the Committee,"Zubiri, Juan Miguel ""Migz"" F."
620,SBN-533,an act encouraging volunteerism during emergencies by protecting volunteers from liability,Pending in the Committee,"Zubiri, Juan Miguel ""Migz"" F."
622,SBN-531,"an act further amending commonwealth act no. 146 otherwise known as the public service act, as amended",Pending in the Committee,"Zubiri, Juan Miguel ""Migz"" F."
623,SBN-530,an act providing for a magna carta for students’ rights and welfare,Pending in the Committee,"Zubiri, Juan Miguel ""Migz"" F."
626,SBN-527,"an act providing for the issuance of a list of low-lying areas of the philippine territory vulnerable to rising sea levels as a result of climate change, and areas at high risk for natural disasters, mandating the department of environment and natural resources, department of science and technology, climate change commission and other concerned government agencies for its regular updating and appropriating funds therefor and for other purposes",Pending in the Committee,"Zubiri, Juan Miguel ""Migz"" F."
630,SBN-523,an act providing for a system of redistributing and recycling food waste to promote food security,Pending in the Committee,"Zubiri, Juan Miguel ""Migz"" F."
631,SBN-522,an act establishing a center for autism and for other purposes,Pending in the Committee,"Zubiri, Juan Miguel ""Migz"" F."
637,SBN-516,an act declaring a national peace policy thereby creating a commission on peace,Pending in the Committee,"Dela Rosa, Ronald ""Bato"""
639,SBN-514,an act providing for the modernization of the philippine national police and for other purposes,Pending in the Committee,"Dela Rosa, Ronald ""Bato"""
642,SBN-511,"an act implementing the right of the people to information on matters of public concern guaranteed under the 1987 philippine constitution, and for other purposes",Pending in the Committee,"Cayetano, Pia S."
643,SBN-510,"an act instituting a national land use policy, providing the implementing mechanisms therefor, and for other purposes",Pending in the Committee,"Cayetano, Pia S."
644,SBN-509,an act protecting the right of athletes to represent the philippines as part of the national team and providing penalties for violations thereof,Pending in the Committee,"Cayetano, Pia S."
645,SBN-508,an act exempting the importation of medical devices and equipment from customs duty and value-added tax,Pending in the Committee,"Cayetano, Pia S."
646,SBN-507,an act exempting the importation of certain medicines from customs duty and value-added tax,Pending in the Committee,"Cayetano, Pia S."
647,SBN-506,an act creating and establishing the philippine high school for sports,Consolidated/Substituted in the Committee Report,"Cayetano, Pia S."
648,SBN-505,"an act amending executive order no. 209, otherwise known as the family code of the philippines and for other purposes",Pending in the Committee,"Cayetano, Pia S."
649,SBN-504,an act recognizing the civil effects of church annulment decree,Pending in the Committee,"Cayetano, Pia S."
650,SBN-503,"an act mandating the use of surveillance cameras for security, safety, and accountability in government offices",Pending in the Committee,"Cayetano, Pia S."
651,SBN-502,"an act requiring the issuance of employment certification in favor of resigned, dismissed or separated employees and providing penalties for violation therefor, amending for this purpose the labor code of the philippines",Pending in the Committee,"Cayetano, Pia S."
652,SBN-501,"an act addressing the system of prostitution, imposing penalties on its perpetrators, providing protective measures and support services for its victims, repealing for the purpose articles 202 and 341 of the penal code",Pending in the Committee,"Cayetano, Pia S."
653,SBN-500,"an act instituting reforms in land administration system, creating the land administration authority, and for other purposes",Pending in the Committee,"Cayetano, Pia S."
654,SBN-499,"an act amending certain provisions of republic act no. 7104 , otherwise known as 'komisyon sa wikang filipino (commission on the filipino language) act' and for other purposes",Pending in the Committee,"Sotto III, Vicente C."
655,SBN-498,an act strengthening the bureau of fire protection and for other purposes,Pending in the Committee,"Sotto III, Vicente C."
656,SBN-497,an act enabling the intellectual property office through the national telecommunications commission to cancel licenses of internet service providers that allow websites to infringe or to facilitate infringement of copyright,Pending in the Committee,"Sotto III, Vicente C."
657,SBN-496,an act regulating vaporized nicotine products,Pending in the Committee,"Sotto III, Vicente C."
658,SBN-495,an act imposing death penalty in the philippines,Pending in the Committee,"Sotto III, Vicente C."
659,SBN-494,"an act amending section 150 of republic act 7160 , otherwise known as 'the local government code of 1991'",Pending in the Committee,"Sotto III, Vicente C."
660,SBN-493,an act banning the use of firecrackers except in designated areas done by professionals,Pending in the Committee,"Sotto III, Vicente C."
661,SBN-492,"an act amending section 23 of republic act no. 9165, otherwise known as the comprehensive dangerous drugs act of 2002 , allowing plea bargaining in certain
cases",Pending in the Committee,"Sotto III, Vicente C."
662,SBN-491,"an act regulating the use of treatment technology for municipal and hazardous wastes, repealing for the purpose section 20 of republic act no. 8749 , entitled 'the philippine clean air act of 1999'",Pending in the Committee,"Sotto III, Vicente C."
663,SBN-490,"an act amending section 13 of the republic act no. 3019, as amended, entitled the 'anti graft and corrupt practices act'",Pending in the Committee,"Sotto III, Vicente C."
664,SBN-489,an act reorganizing the comelec offices,Pending in the Committee,"Sotto III, Vicente C."
665,SBN-488,"an act allowing the monetization of maternity leave credits of female employees and the covered social security system (sss) female members, and for other purposes",Pending in the Committee,"Sotto III, Vicente C."
666,SBN-487,"an act modernizing the national measurement system (nms) of the philippines, creating for this purpose the national measurement in stitute of the philippines, 
appropriating funds therefor and for other purposes",Pending in the Committee,"Sotto III, Vicente C."
667,SBN-486,"an act to maximize the contribution of unpaid care workers to nation building, grant benefits and privileges, and for other purposes",Pending in the Committee,"Sotto III, Vicente C."
668,SBN-485,an act creating a friendly working environment for women and for other purposes,Pending in the Committee,"Sotto III, Vicente C."
669,SBN-484,"an act exempting all vehicles from paying toll fees on certain holidays, amending for the purpose presidential decree no. 1112, as amended",Pending in the Committee,"Sotto III, Vicente C."
670,SBN-483,"an act establishing the barangay integrated development approach for nutrition improvement (bidani) of the rural poor as a linkage program for all state
universities and colleges (sucs) and community colleges and appropriating funds therefor",Pending in the Committee,"Sotto III, Vicente C."
671,SBN-482,an act providing for a rural employment assistance program and appropriating funds therefor,Pending in the Committee,"Sotto III, Vicente C."
672,SBN-481,an act declaring july 27 of every year as a special national nonworking holiday in commemoration of the founding anniversary of the iglesia ni cristo in the philippines,Pending in the Committee,"Recto, Ralph G."
673,SBN-480,"an act establishing lesbian, gay, bisexual, transgender, queer, intersexual, asexual, and individuals of various sexual and gender orientations (lgbtqia+) help and protection desks in all philippine national police stations, amending for the purpose title vii of republic act number 8551, as amended, otherwise known as the 'philippine national police reform and reorganization act of 1998,' and for other purposes",Pending in the Committee,"Recto, Ralph G."
674,SBN-479,"an act exempting the manufacture, assembly, conversion and importation of plug-in hybrid electric vehicles from the payment of excise taxes and duties, and for other purposes",Pending in the Committee,"Recto, Ralph G."
675,SBN-478,"an act modernizing agriculture, providing funds from the annual valueadded tax collections, amending for the purpose the national internal revenue code of 1997, as amended",Pending in the Committee,"Recto, Ralph G."
676,SBN-477,"an act mandating the annual public disclosure of all contingent liabilities incurred by all national government agencies, local government units, government-
owned or -controlled corporations, government financial institutions, and other government instrumentalities",Pending in the Committee,"Recto, Ralph G."
677,SBN-476,"an act mandating the secretaries of the department of finance, national economic and development authority, and department of budget and management, and  the governor of the bangko sentral ng pilipinas, to appear semi-annually before congress to report on the status and directions of the fiscal and monetary policies of the state",Pending in the Committee,"Recto, Ralph G."
678,SBN-475,"an act expanding the coverage of micro enterprises as beneficiaries of the magna carta for micro, small and medium enterprises, amending for the purpose republic act no. 6977, as amended",Pending in the Committee,"Recto, Ralph G."
679,SBN-474,an act providing for the fair and equitable allocation of farm-to-market roads projects of the department of agriculture,Pending in the Committee,"Recto, Ralph G."
680,SBN-473,"an act increasing to three thousand pesos (p3,000) the monthly personnel economic relief allowance (pera) granted to government employees, appropriating funds therefor and for other purposes",Pending in the Committee,"Recto, Ralph G."
681,SBN-472,"an act promoting environmentally sustainable transport by providing incentives for the manufacture, assembly, conversion and importation of electric, hybrid and other green vehicles, and for other purposes",Pending in the Committee,"Recto, Ralph G."
682,SBN-471,an act requiring internet service providers to deliver a minimum standard for internet connection speed,Pending in the Committee,"Recto, Ralph G."
684,SBN-469,"an act instituting reforms to further protect and develop micro, small and medium enterprises, amending for the purpose executive order no. 81, otherwise known as 'the 1986 revised charter of the of the development bank of the ph ilippines,' as amended",Pending in the Committee,"Recto, Ralph G."
685,SBN-468,"an act prioritizing the agricultural sector in the grant of loans by the land bank of the ph ilippines , amending for the purpose republic act no. 3844 , as amended",Pending in the Committee,"Recto, Ralph G."
686,SBN-467,"an act creating the department of fisheries and aquatic resources, providing for its powers and functions, appropriating funds therefor, and for other purposes",Pending in the Committee,"Recto, Ralph G."
687,SBN-466,"an act providing for a ten thousand peso (p10,000.00) across-the-board increase in the basic monthly salary of all public elementary and secondary school teachers and appropriating funds therefor",Pending in the Committee,"Recto, Ralph G."
688,SBN-465,"an act amending book 3, title 5, article 13, section 483 of republic act no. 7160, otherwise known as the local government code of 1991, as amended",Pending in the Committee,"Revilla Jr., Ramon Bong"
689,SBN-464,"“an act establishing a drug treatment and rehabilitation center in the city of bacoor, province of cavite, to be known as the city of bacoor drug treatment and rehabilitation center and appropriating funds therefor",Pending in the Committee,"Revilla Jr., Ramon Bong"
690,SBN-463,an act providing for the magna carta of the out-of-school youth,Pending in the Committee,"Revilla Jr., Ramon Bong"
691,SBN-462,"an act expanding the jurisdiction of the philippine drug enforcement agency, defining the prosecutorial powers provided thereto, and amending for the purpose republic act no. 9165, otherwise known as the comprehensive dangerous drugs act of 2002, as amended",Pending in the Committee,"Revilla Jr., Ramon Bong"
692,SBN-461,"an act creating the department of overseas filipino workers, defining its powers and functions, appropriating funds therefor, and for other purposes",Pending in the Committee,"Revilla Jr., Ramon Bong"
693,SBN-460,"an act amending sections 212 and 214 of republic act no. 7160, as amended, otherwise known as the local government code of 1991",Pending in the Committee,"Revilla Jr., Ramon Bong"
694,SBN-459,"an act amending article 2206 of republic act no. 386, otherwise known as the civil code of the philippines",Pending in the Committee,"Revilla Jr., Ramon Bong"
695,SBN-458,"an act further amending presidential decree no. 442, otherwise known as the ‘labor code of the philippines’, as amended",Pending in the Committee,"Revilla Jr., Ramon Bong"
696,SBN-457,an act declaring january twenty-two (22) of every year as a special working holiday to be known as national farmer’s day,Pending in the Committee,"Revilla Jr., Ramon Bong"
697,SBN-456,"an act providing for a three thousand peso (p3,000.00) increase in the monthly pension of war veterans and their dependents",Pending in the Committee,"Revilla Jr., Ramon Bong"
698,SBN-455,"an act to further strengthen the apprehension against the obstruction of justice, amending for the purpose section 1 of presidential decree no. 1829, otherwise known as penalizing obstruction of apprehension and prosecution of criminal offenders",Pending in the Committee,"Revilla Jr., Ramon Bong"
699,SBN-454,an act protecting the users of radio frequency identification devices (rfid),Pending in the Committee,"Revilla Jr., Ramon Bong"
700,SBN-453,"an act granting tax relief to persons with disabilities (pwds), and for other purposes",Pending in the Committee,"Revilla Jr., Ramon Bong"
701,SBN-452,"an act granting additional insurance benefits to all public school teachers, providing funds for the payment of its premiums, and for other purposes",Pending in the Committee,"Revilla Jr., Ramon Bong"
702,SBN-451,"an act requiring the teaching of basic road safety and comprehensive drivers’ education as part of the curriculum of the k-12 program, and for other purposes",Pending in the Committee,"Revilla Jr., Ramon Bong"
703,SBN-450,"an act imposing stiffer penalties for child abuse, exploitation and discrimination, amending for the purpose republic act no. 7610, as amended",Pending in the Committee,"Revilla Jr., Ramon Bong"
704,SBN-449,an act upgrading the position of sanitation inspector to the next higher salary grade and appropriating funds therefor,Pending in the Committee,"Revilla Jr., Ramon Bong"
705,SBN-448,"an act prohibiting the use of words that would denote religious, regional or ethnic affiliation in print, radio, television including cable television and other forms of broadcast media to refer to or describe any person suspected or convicted of a crime or unlawful act and providing penalties therefor",Pending in the Committee,"Revilla Jr., Ramon Bong"
706,SBN-447,"an act to enhance the use of national wealth for local development by amending certain provisions in book ii of republic act 7160, otherwise known as the ‘local government code of 1991’",Pending in the Committee,"Revilla Jr., Ramon Bong"
707,SBN-446,an act granting incentives and other benefits to rural health unit doctors and for other purposes,Pending in the Committee,"Revilla Jr., Ramon Bong"
708,SBN-445,"an act protecting consumers from unreasonable fee increases by providing for a consumer group representation in the governing boards of government regulatory bodies, amending for the purpose their respective charters, and for other purposes",Pending in the Committee,"Revilla Jr., Ramon Bong"
709,SBN-444,"an act increasing the tax on idle lands, amending for the purpose section 236 of republic act no. 7160, otherwise known as the local government code of 1991",Pending in the Committee,"Revilla Jr., Ramon Bong"
710,SBN-443,"an act establishing resource centers for indigenous peoples to enhance and ensure delivery of essential services, appropriating funds therefor and for other purposes",Pending in the Committee,"Revilla Jr., Ramon Bong"
712,SBN-441,"an act amending sections 3, 5, and 7 of republic act no. 7900, otherwise known as the high value crops development act of 1995 and for other purposes",Pending in the Committee,"Revilla Jr., Ramon Bong"
713,SBN-440,"an act expanding the prohibited acts of discrimination against women on account of sex, amending for the purpose articles 133 and 1351 of presidential decree no. 442, as amended, otherwise known as the labor code of the philippines",Pending in the Committee,"Revilla Jr., Ramon Bong"
715,SBN-438,"an act protecting the remittances or money transfers of overseas filipino workers (ofws) by requiring the disclosure of finance charges and other fees in connection with money transfer, compelling strict adherence to the terms and conditions of their transfer, penalizing violations thereof, and for other purposes",Pending in the Committee,"Revilla Jr., Ramon Bong"
716,SBN-437,an act strengthening the role of parents associations and creating for the purpose the national parent council,Pending in the Committee,"Revilla Jr., Ramon Bong"
717,SBN-436,"an act regulating the imposition of fees for the use of parking spaces located within commercial and business establishments, institutions and parking facilities",Pending in the Committee,"Revilla Jr., Ramon Bong"
718,SBN-435,"an act providing for additional benefits and privileges to public school teachers amending for the purpose republic act no. 4670, otherwise known as the magna carta for public school teachers, and for other purposes",Pending in the Committee,"Revilla Jr., Ramon Bong"
719,SBN-434,an act establishing at least one (1) special education (sped) center for each school division and at least three (3) sped centers in big school divisions for children with special needs (csn) providing guidelines therefor and for other purposes,Pending in the Committee,"Revilla Jr., Ramon Bong"
720,SBN-433,"an act changing the composition of the advisory committee of the national council for the children’s television, amending for the purpose section 6 of republic act no. 8370, otherwise known as the ‘children’s television act of 1997",Pending in the Committee,"Revilla Jr., Ramon Bong"
721,SBN-432,"an act mandating the secretaries of the department of finance, national economic and development authority, and department of budget and management, and the governor of the bangko sentral ng pilipinas, to appear biannually before a joint congressional oversight committee report on the status and directions of the fiscal and monetary policies of the state",Pending in the Committee,"Revilla Jr., Ramon Bong"
722,SBN-431,"an act ensuring the occupational health, safety and welfare of business process outsourcing (bpo) workers and other similarly situated professionals",Pending in the Committee,"Revilla Jr., Ramon Bong"
