,num,long_title,status,author
723,SBN-430,an act integrating education on the 1987 constitution of the republic of the philippines in the grade 12 senior high school curricula of all public and private educational institutions,Pending in the Committee,"Pangilinan, Francis ""Kiko"" N."
724,SBN-429,"an act requiring crematories to collect from the decedent’s remains tissue samples for dna sampling and/or storage, fingerprints or thumbprints, and digital photos, providing penalties therefor and for other purposes",Pending in the Committee,"Pangilinan, Francis ""Kiko"" N."
725,SBN-428,"an act requiring mandatory autopsy on bodies of crime victims, deaths under mysterious and suspicious circumstances, and for other purposes",Pending in the Committee,"Pangilinan, Francis ""Kiko"" N."
726,SBN-427,"an act mandating law enforcement personnel to wear a body camera during law enforcement and special police operations, providing guidelines for the use of body camera and video footage retention, and penalizing non-compliance with recording and retention requirements",Pending in the Committee,"Pangilinan, Francis ""Kiko"" N."
727,SBN-426,"an act providing for the share in the national taxes of local government units, amending for the purpose republic act no. 7160, otherwise known as the local government code of 1991",Pending in the Committee,"Pangilinan, Francis ""Kiko"" N."
728,SBN-425,"an act increasing the service incentive leave of employees, amending for the purpose article 95 of presidential decree no. 442, as amended, otherwise known as the labor code of the philippines",Pending in the Committee,"Pangilinan, Francis ""Kiko"" N."
729,SBN-424,an act granting civil service eligibility to casual or contractual employees of the government who have rendered at least five (5) years of continuous efficient service,Pending in the Committee,"Pangilinan, Francis ""Kiko"" N."
730,SBN-423,an act reducing food waste through food donations and food waste recycling,Pending in the Committee,"Pangilinan, Francis ""Kiko"" N."
731,SBN-422,"an act amending republic act no. 7166, otherwise known as an act providing for synchronized national and local elections and for electoral reforms, as amended by republic act no. 9369, and for other purposes",Pending in the Committee,"Pangilinan, Francis ""Kiko"" N."
732,SBN-421,"an act strengthening the political party system of the philippines, creating a state subsidy fund, and for other purposes",Pending in the Committee,"Pangilinan, Francis ""Kiko"" N."
733,SBN-420,"an act establishing job placement offices in public high schools to provide career services to the youth, appropriating funds therefor, and for other purposes",Pending in the Committee,"Pangilinan, Francis ""Kiko"" N."
734,SBN-419,"an act amending commonwealth act no. 146, otherwise known as the public service act, as amended, and for other purposes",Pending in the Committee,"Pangilinan, Francis ""Kiko"" N."
735,SBN-418,"an act amending republic act no. 7042, otherwise known as the foreign investments act of 1991, as amended by republic act no. 8179, and for other purposes",Pending in the Committee,"Pangilinan, Francis ""Kiko"" N."
736,SBN-417,an act instituting a property regime for cohabiting same sex partners and for other purposes,Pending in the Committee,"Marcos, Imee R."
738,SBN-415,"an act providing for the rank classification in the bureau of fire protection (bfp) and bureau of jail management and penology (bjmp), amending for the purpose sections 58 and 64 of republic act number 6975, as amended, otherwise known as the ‘department of interior and local government act of 1990",Pending in the Committee,"Lacson, Panfilo ""Ping"" M."
739,SBN-414,"an act providing a national policy on the prevention of teenage pregnancy, and appropriating funds therefor",Pending in the Committee,"Marcos, Imee R."
742,SBN-411,an act to develop and promote the creative industries of the philippines,Pending in the Committee,"Marcos, Imee R."
744,SBN-409,"an act recognizing motorcycles as public utility vehicles, amending for this purpose republic act no. 4136, otherwise known as the ‘land transportation and traffic code’ and republic act no. 7160, otherwise known as the ‘local government code’, as amended, and for other purposes",Pending in the Committee,"Marcos, Imee R."
748,SBN-405,"an act providing for a proportionate school admission and acceptance share in the philippine military academy and the philippine national police academy for members of the indigenous cultural communities/ indigenous peoples, and for such other purposes",Pending in the Committee,"Tolentino, Francis ""Tol"" N."
749,SBN-404,an act to improve the efficiency of national research and development,Pending in the Committee,"Tolentino, Francis ""Tol"" N."
753,SBN-400,an act penalizing prank callers to emergency hotlines,Pending in the Committee,"Go, Christopher Lawrence T."
755,SBN-398,"an act expanding the coverage of the mandatory basic immunization program and providing a system in the determination of other types of vaccine-preventable diseases, amending for the purpose republic act no. 10152, otherwise known as the ‘mandatory infants and children health immunization act of 2011",Pending in the Committee,"Go, Christopher Lawrence T."
756,SBN-397,"an act creating and establishing the national academy of sports, providing funds therefor",Consolidated/Substituted in the Committee Report,"Go, Christopher Lawrence T."
760,SBN-393,"an act providing free legal assistance to any officer or enlisted personnel of the armed forces of the philippines and the philippine national police on any charge before the prosecutor’s office, court or any competent body arising from an incident or incidents related to the performance of official duty",Pending in the Committee,"Go, Christopher Lawrence T."
762,SBN-391,an act providing for a magna carta for barangays,Pending in the Committee,"Go, Christopher Lawrence T."
764,SBN-389,an act creating lake lanao development authority providing funds therefor,Pending in the Committee,"Pacquiao, Emmanuel ""Manny"" D."
765,SBN-388,an act requiring the registration of subscriber identity module (sim) cards in mobile phones,Pending in the Committee,"Pacquiao, Emmanuel ""Manny"" D."
768,SBN-385,an act providing for the protection of the rights of airline passengers,Pending in the Committee,"Pacquiao, Emmanuel ""Manny"" D."
770,SBN-383,"an act amending sections 141, 142 and 143 of republic act no. 8424, as amended, otherwise known as the ‘national internal revenue code of 1997",Consolidated/Substituted in the Committee Report,"Pacquiao, Emmanuel ""Manny"" D."
773,SBN-380,an act strengthening the regulation of social welfare and development agencies,Pending in the Committee,"De Lima, Leila M."
774,SBN-379,"an act protecting the rights of refugees and stateless persons, establishing the refugees and stateless persons protection board, and for other purposes",Pending in the Committee,"De Lima, Leila M."
775,SBN-378,"an act protecting women in state custody, prescribing the minimum standards for their treatment, penalizing acts in violations thereof and for other purposes",Pending in the Committee,"De Lima, Leila M."
776,SBN-377,"an act ensuring accountability in intelligence activities and the use of intelligence and confidential funds granted to all government agencies, establishing for the purpose a joint congressional intelligence committee to strengthen the oversight powers of congress to monitor intelligence activities of all agencies of the philippine government and to oversee how intelligence and confidential funds are expended, and for other purposes",Pending in the Committee,"De Lima, Leila M."
777,SBN-376,an act declaring july 12 of every year as a special working holiday in the entire country to commemmorate the historic decision of the permanent court of arbitration (pca) in favor of philippine sovereignty over the west philippine sea,Pending in the Committee,"De Lima, Leila M."
778,SBN-375,"an act to strengthen the human rights affairs office of the philippine national police and to further amend republic act no. 6975, otherwise known as the ‘department of the interior and local government act of 1990’, as amended, and for other purposes",Pending in the Committee,"De Lima, Leila M."
779,SBN-374,"an act amending republic act no. 1405, also known as the bank secrecy law, as amended, by removing from its coverage, government officials and employees, and for other purposes",Pending in the Committee,"De Lima, Leila M."
780,SBN-373,"an act amending articles 180, 183, and 184 of act no. 3815, otherwise known as the revised penal code, as amended, increasing the penalties thereof, criminalizing subornation of perjury, and for other purposes",Pending in the Committee,"De Lima, Leila M."
781,SBN-372,"an act strengthening the party-list act and emphazising its role as a constitutional social justice tool to give the marginalized and underrepresented genuine power and representation, amending for the purpose republic act no. 7941, entitled ‘an act providing for the election of party-list representatives through the party-list system, and appropriating funds therefor’, otherwise known as the ‘party-list system act’, and for other purposes",Pending in the Committee,"De Lima, Leila M."
782,SBN-371,"an act defining extrajudicial killing, providing for its penalty and other purposes",Pending in the Committee,"De Lima, Leila M."
783,SBN-370,an act prescribing the mandatory guidelines on the establishment and operation of local universities and colleges and for other purposes,Pending in the Committee,"Gatchalian, Win"
784,SBN-369,"an act promoting the establishment of public math and science high schools in previously underserved areas, and appropriating funds therefor",Pending in the Committee,"Gatchalian, Win"
785,SBN-368,an act regulating the sale of motor vehicles in metro manila by requiring a proof-of-parking space or facility from motor vehicle buyers as a prerequisite for the purchase of a motor vehicle and registration with the land transportation office,Pending in the Committee,"Gatchalian, Win"
786,SBN-367,"an act instituting a program for the mandatory continuing education of teachers in the primary and secondary levels in both public and private schools, and appropriating funds therefor",Pending in the Committee,"Gatchalian, Win"
787,SBN-366,magna carta for barangay officials,Pending in the Committee,"Gatchalian, Win"
788,SBN-365,an act prohibiting all public telecommunications entities and information and communications technology providers from imposing an expiration period on the validity of period load credits and their forfeiture,Pending in the Committee,"Gatchalian, Win"
789,SBN-364,an act reducing the recoverable system loss rate and for other purposes,Pending in the Committee,"Gatchalian, Win"
790,SBN-363,an act establishing a national energy policy and regulatory framework for facilities utilizing waste-to-energy technologies,Pending in the Committee,"Gatchalian, Win"
791,SBN-362,an act institutionalizing reforms in the procurement of supply by distribution utilities for the captive market by mandating a competitive selection process for power supply agreements,Pending in the Committee,"Gatchalian, Win"
792,SBN-361,an act providing for a national framework for students’ rights and welfare,Pending in the Committee,"Hontiveros, Risa"
793,SBN-360,"an act regulating the catching, sale, purchase, possession, transportation, importation, and exportation of all sharks, rays, and chimaeras and any part thereof in the country",Pending in the Committee,"Hontiveros, Risa"
794,SBN-359,"an act mainstreaming the public health approach to philippine drug policy, establishing and implementing community-based programs and strategies for drug-related issues and concerns, and prohibiting harmful and discriminatory interventions and practices, appropriating funds therefor, and for other purposes",Pending in the Committee,"Hontiveros, Risa"
795,SBN-358,"an act instituting a national land use and management policy, providing the implementing mechanisms therefor, and for other purposes",Pending in the Committee,"Hontiveros, Risa"
796,SBN-357,an act instituting the magna carta of filipino seafarers,Pending in the Committee,"Hontiveros, Risa"
797,SBN-356,an act instituting absolute divorce in the philippines,Pending in the Committee,"Hontiveros, Risa"
798,SBN-355,"an act amending sections 106, 107, 108, 109, and 112 of republic act no. 8424, otherwise known as the ‘tax reform act of 1997,’ as amended, and for other purposes",Pending in the Committee,"Hontiveros, Risa"
799,SBN-354,"an act defining and prohibiting elder abuse, providing penalties therefor, and for other purposes",Pending in the Committee,"Hontiveros, Risa"
800,SBN-353,"an act to regulate the rational exploration, development and utilization of mineral resources, and to ensure the equitable sharing of benefits for the state, indigenous peoples and local communities, and for other purposes",Pending in the Committee,"Hontiveros, Risa"
811,SBN-342,"an act providing for the employment of nurses, assigning at least one registered nurse for every barangay in the philippines, and for other purposes",Pending in the Committee,"Villar, Cynthia A."
812,SBN-341,an act establishing the small and medium enterprises stock exchange,Pending in the Committee,"Villar, Cynthia A."
813,SBN-340,"an act prohibiting text scams, misleading advertisements, and fraudulent sales promotions, mandating for this purpose the registration of all users of subscriber identity module (sim) cards, and providing penalties for the violations thereof",Pending in the Committee,"Villar, Cynthia A."
814,SBN-339,"an act providing stiffer penalties for theft, robbery and destruction of public school property",Pending in the Committee,"Villar, Cynthia A."
815,SBN-338,"an act instituting inclusive education, establishing inclusive education learning resource centers for children and youth with special needs (cysns) in all public schools divisions, providing for standards and guidelines, and appropriating funds thereof",Pending in the Committee,"Villar, Cynthia A."
816,SBN-337,"an act institutionalizing the bamboo industry development in the philippines, creating the bamboo industry research and development center (birdc), appropriating funds therefor, and for other purposes",Pending in the Committee,"Villar, Cynthia A."
817,SBN-336,"an act requiring new commercial, institutional, and residential infrastructure projects in metro manila and major cities in the philippines to install rainwater harvesting or retention facilities, providing penalties for violations, and for other purposes",Pending in the Committee,"Villar, Cynthia A."
818,SBN-335,"an act regulating the catching, sale, purchase, possession, transportation, importation, and exportation of all sharks, rays, and chimaeras and any part thereof in the country",Pending in the Committee,"Villar, Cynthia A."
819,SBN-334,an act to adopt integrated coastal management as a national strategy to ensure the sustainable development of the coastal and marine environment and resources and to establish supporting mechanisms for its implementation and provide funds therefor,Pending in the Committee,"Villar, Cynthia A."
820,SBN-333,"an act regulating the manufacturing, importation, and use of single-use plastic products, and providing penalties, levies and incentives system for industries, business enterprises and consumers thereof, and for other purposes",Pending in the Committee,"Villar, Cynthia A."
821,SBN-332,"an act promoting sustainable and alternative modes of transportation and other mobility options to improve air quality, increase efficiency, reduce congestion, and contribute to positive health impacts in our society",Pending in the Committee,"Angara, Sonny"
822,SBN-331,"an act creating the department of disaster resilience, defining its power and functions, appropriating funds therefor",Pending in the Committee,"Angara, Sonny"
823,SBN-330,an act creating and establishing the philippine high school for sports,Consolidated/Substituted in the Committee Report,"Angara, Sonny"
824,SBN-329,"an act instituting inclusive education and the establishment of inclusive education learning resource centers for children and youth with special needs in all public schools divisions, providing for standards and guidelines, and appropriating funds therefor",Pending in the Committee,"Angara, Sonny"
825,SBN-328,"an act providing for the magna carta of workers in informal economy, institutionalizing mechanisms for implementation thereof and for other purposes",Pending in the Committee,"Angara, Sonny"
826,SBN-327,"an act creating the mindanao railways corporation, prescribing its powers, functions and duties, and providing for the necessary funds for its operation",Pending in the Committee,"Angara, Sonny"
827,SBN-326,"an act providing the direct remittance to the host local government units of their forty percent (40%) share derived from the national wealth amending for the purpose section 293 of republic act no. 7160, otherwise known as the ‘local government code of 1991",Pending in the Committee,"Angara, Sonny"
828,SBN-325,"an act providing for a comprehensive nursing law towards quality health care system, and appropriating funds therefor",Pending in the Committee,"Angara, Sonny"
829,SBN-324,an act implementing the people's right to information and the constitutional policies of full public disclosure and honesty in the public service and for other purposes,Pending in the Committee,"Angara, Sonny"
830,SBN-323,an act supporting the production of philippine independent films by providing incentives to filmmakers who are given honors in notable international film competitions,Pending in the Committee,"Poe, Grace"
831,SBN-322,"an act establishing a framework for film and television tourism in the philippines, marketing the industry globally and providing employment for the sector and for other purposes",Pending in the Committee,"Poe, Grace"
834,SBN-319,"an act promoting sustainable and alternative modes of transportation and other mobility options to improve air quality, increase efficiency, reduce congestion and contribute to positive health impacts in our society",Pending in the Committee,"Poe, Grace"
836,SBN-317,an act establishing a credit assistance program for overseas filipino workers,Pending in the Committee,"Poe, Grace"
837,SBN-316,"an act improving and promoting quality delivery of health services by barangay health workers in the barangay level, providing funds therefor, and for other purposes",Pending in the Committee,"Poe, Grace"
838,SBN-315,"an act prohibiting discrimination on the basis of ethnicity, race, religion or belief, sex or gender or sexual orientation, language, disability, educational attainment, and other forms of discrimination, providing penalties therefor, and for other purposes",Pending in the Committee,"Poe, Grace"
839,SBN-314,"an act providing for a magna carta of workers, enterprises and organizations in the informal economy, institutionalizing mechanisms for implementation thereof and for other purposes",Pending in the Committee,"Poe, Grace"
840,SBN-313,an act establishing the fiscal regime for the mining industry,Pending in the Committee,"Zubiri, Juan Miguel ""Migz"" F."
841,SBN-312,"an act repealing the minimum height requirement for applicants to the philippine national police (pnp), the bureau of fire protection (bfp), and the bureau of jail management and penology (bjmp)",Pending in the Committee,"Zubiri, Juan Miguel ""Migz"" F., Sotto III, Vicente C., Lacson, Panfilo ""Ping"" M."
844,SBN-309,"an act establishing the drug price regulatory board to regulate the prices of drugs and medicines in the philippines amending for the purpose republic act no. 9502, otherwise known as the ‘universally accessible cheaper and quality medicines act of 2008’ and for other purposes",Pending in the Committee,"Zubiri, Juan Miguel ""Migz"" F."
845,SBN-308,"an act creating the mindanao railways authority (mra), prescribing its powers, functions and duties, amending for the purpose republic act no. 4156 entitled ‘an act creating the philippine national railways, prescribing its powers, functions and duties, and providing for the necessary funds for its operation’ as amended by r. a. no. 6366, appropriating funds therefor, and for other purposes",Pending in the Committee,"Zubiri, Juan Miguel ""Migz"" F."
848,SBN-305,"an act increasing the age for determining statutory rape to provide stronger protection for children, and amending for this purpose act no. 3815, otherwise known as the revised penal code, as amended by republic act 8353, otherwise known as the anti-rape law of 1997",Pending in the Committee,"Zubiri, Juan Miguel ""Migz"" F."
849,SBN-304,"an act providing for the development of a national defense industry through the strengthening and revitalizing of the self reliant defense posture (srdp) program, incentivizing in-country enterprises, rationalizing defense acquisition, and creating the office of the undersecretary for defense technology research and industry development under the department of national defense, and providing funds therefor",Pending in the Committee,"Zubiri, Juan Miguel ""Migz"" F."
850,SBN-303,"an act granting 15 days of paid leave a year to employees whose spouse, parent, unmarried child, or when they themselves are suffering from serious illness",Pending in the Committee,"Revilla Jr., Ramon Bong"
851,SBN-302,an act increasing the salary grade of public school teachers from salary grade 11 to 15 and providing funds therefor,Pending in the Committee,"Revilla Jr., Ramon Bong"
852,SBN-301,"an act amending section 12-b of republic act no. 8282 entitled 'an act further strengthening the social security system thereby amending for this purpose, republic act no. 1161, as amended, otherwise known as the social security law'",Pending in the Committee,"Revilla Jr., Ramon Bong"
853,SBN-300,an act instituting the magna carta of filipino seafarers,Pending in the Committee,"Revilla Jr., Ramon Bong"
854,SBN-299,the magna carta for day care workers,Pending in the Committee,"Revilla Jr., Ramon Bong"
855,SBN-298,"an act requiring all national, regional, and provincial government hospitals to establish, operate and maintain a dialysis ward or unit in their respective hospital and providing free dialysis treatment to indigent patients",Pending in the Committee,"Revilla Jr., Ramon Bong"
856,SBN-297,"an act expanding the coverage of the senior citizens' act, amending for the purpose republic act no. 7432, as amended",Pending in the Committee,"Revilla Jr., Ramon Bong"
857,SBN-296,an act to establish an elderly care and nursing complex in every province and city and appropriating funds therefor,Pending in the Committee,"Revilla Jr., Ramon Bong"
858,SBN-295,"an act amending section 2 of republic act no. 10868, otherwise known as the centenarians act of 2016 and for other purposes",Pending in the Committee,"Revilla Jr., Ramon Bong"
859,SBN-294,an act providing for occupational safety and health standards for the workers and talents in the movie and television industry,Pending in the Committee,"Revilla Jr., Ramon Bong"
860,SBN-293,an act establishing an integrated utilization and promotion of folic acid food fortification and supplementation,Pending in the Committee,"Cayetano, Pia S."
861,SBN-292,"an act institutionalizing microfinance programs for the development of micro and small enterprises (mses), allocating funds therefor, and for other purposes",Pending in the Committee,"Cayetano, Pia S."
862,SBN-291,"an act increasing the maximum value of the family home exempt from execution, forced sale or attachment, amending for the purpose article 157 of the family code of the philippines, as amended",Pending in the Committee,"Cayetano, Pia S."
863,SBN-290,"an act mandating the appointment of one midwife for each barangay, and for other purposes",Pending in the Committee,"Cayetano, Pia S."
864,SBN-289,"an act creating the department of disaster resilience (ddr), appropriating funds therefor, and for other purposes",Pending in the Committee,"Cayetano, Pia S."
865,SBN-288,an act instituting absolute divorce and dissolution of marriage in the philippines,Pending in the Committee,"Cayetano, Pia S."
866,SBN-287,"an act establishing specialty centers attached to existing hospitals and medical centers of the department of health, and appropriating funds therefor",Pending in the Committee,"Cayetano, Pia S."
867,SBN-286,an act providing for the magna carta of student-athletes,Pending in the Committee,"Cayetano, Pia S."
868,SBN-285,"an act promoting and recognizing bicycles as an alternative mode of transportation, and for other purposes",Pending in the Committee,"Cayetano, Pia S."
869,SBN-284,an act providing for the sustainable management of forests and forest lands and for other purposes,Pending in the Committee,"Cayetano, Pia S."
870,SBN-283,"an act revitalizing the bases conversion development, amending for the purpose republic act no. 7227, otherwise known as the bases conversion and development act of 1992, as amended",Pending in the Committee,"Lapid, Manuel ""Lito"" M."
871,SBN-282,an act requiring the listing of calorie content information on menus and boards of food establishments,Pending in the Committee,"Lapid, Manuel ""Lito"" M."
872,SBN-281,an act to regulate public solicitation and providing funds therefor,Pending in the Committee,"Lapid, Manuel ""Lito"" M."
873,SBN-280,an act to promote urban agriculture and vertical farming in the country’s metropolitan areas to address food security concerns and regenerate ecosystem functions and appropriating funds therefor,Pending in the Committee,"Lapid, Manuel ""Lito"" M."
