6008,15SBN-2846,SBN-2846,15,"an act extending the implementation of the lifeline rate, amending for the purpose section 73 of the republic act numbered ninety one thirty six, otherwise known as the electric power industry reform act of 2001",2011-05-26,National,Approved by the President of the Philippines,"Osmena III, Sergio R., Escudero, Francis ""Chiz"" G., Enrile, Juan Ponce",2011-06-21,True,Sergio Osmena III,Independent,Majority,16.0,3,26.0,False,5,2.0,True,True,211
6012,15SBN-2842,SBN-2842,15,"an act amending certain provisions of republic act no. 8293, otherwise known as 'the intellectual property code of the philippines', and for other purposes",2011-05-25,National,Approved by the President of the Philippines,"Trillanes, Antonio ""Sonny"" F., Ejercito-Estrada, Jinggoy P., Lapid, Manuel ""Lito"" M., Defensor Santiago, Miriam, Angara, Edgardo J., Villar, Manny B., Legarda, Loren B., Sotto III, Vicente C.",2013-02-28,True,Antonio Trillanes IV,Nacionalista,Minority,6.0,8,645.0,True,5,2.0,True,False,155
6037,15SBN-2817,SBN-2817,15,an act defining and penalizing the crime of enforced or involuntary disappearance,2011-05-11,National,Approved by the President of the Philippines,"Escudero, Francis ""Chiz"" G., Villar, Manny B., Defensor Santiago, Miriam, Pangilinan, Francis N., Revilla Jr., Ramon A.",2012-12-21,True,Francis Escudero,Independent,Majority,5.0,5,590.0,True,5,2.0,True,True,81
6043,15SBN-2811,SBN-2811,15,"an act establishing the people's survival fund to provide long-term finance streams to enable the government to effectively address the problem of climate change, amending for the purpose republic act no. 9729, otherwise known as the 'climate change act of 2009', and for other purposes",2011-05-10,National,Approved by the President of the Philippines,"Enrile, Juan Ponce, Legarda, Loren B., Recto, Ralph G., Drilon, Franklin M., Lapid, Manuel ""Lito"" M.",2012-08-16,True,Juan Ponce Enrile,PMP,Majority,25.0,5,464.0,True,5,2.0,True,True,286
6046,15SBN-2808,SBN-2808,15,"an act amending article 39 of act no. 3815, as amended, otherwise known as the revised penal code",2011-05-09,National,Approved by the President of the Philippines,"Honasan II, Gregorio B., Villar, Manny B., Defensor Santiago, Miriam, Escudero, Francis ""Chiz"" G., Revilla Jr., Ramon A.",2012-04-11,True,Gringo Honasan II,Independent,Majority,17.0,5,338.0,False,5,2.0,True,True,97
6058,15SBN-2796,SBN-2796,15,"an act defining cybercrime, providing for prevention, investigation and imposition of penalties therefor and for other purposes",2011-05-03,National,Approved by the President of the Philippines,"Trillanes, Antonio ""Sonny"" F., Angara, Edgardo J., Enrile, Juan Ponce, Ejercito-Estrada, Jinggoy P., Lapid, Manuel ""Lito"" M., Villar, Manny B., Defensor Santiago, Miriam, Marcos, Ferdinand ""Bongbong"" R., Revilla Jr., Ramon A., Legarda, Loren B.",2012-09-12,True,Antonio Trillanes IV,Nacionalista,Minority,5.0,10,498.0,True,5,2.0,True,False,127
6106,15SBN-2748,SBN-2748,15,"an act requiring all concerned government agencies to ensure the release of the retirement pay, pensions, gratuities and other benefits of retiring government employees within a period of thirty (30) days after his or her actual date of retirement",2011-03-16,National,Approved by the President of the Philippines,"Trillanes, Antonio ""Sonny"" F., Recto, Ralph G., Villar, Manny B., Revilla Jr., Ramon A.",2011-07-15,True,Antonio Trillanes IV,Nacionalista,Minority,4.0,4,121.0,False,3,1.0,True,False,247
6128,15SBN-2726,SBN-2726,15,"an act decriminalizing vagrancy amending for this purpose article 202 of act no. 3815, as amended, otherwise known as the revised penal code",2011-03-02,National,Approved by the President of the Philippines,"Ejercito-Estrada, Jinggoy P., Legarda, Loren B., Escudero, Francis ""Chiz"" G., Defensor Santiago, Miriam, Zubiri, Juan Miguel F., Revilla Jr., Ramon A.",2012-03-27,True,Jinggoy Ejercito-Estrada,PMP,Majority,8.0,6,391.0,True,3,1.0,True,True,140
6153,15SBN-2701,SBN-2701,15,"an act expanding the exceptions from the nightwork prohibition of women employees, thereby amending articles 130 and 131 of presidential decree number four hundred forty two (pd 442), as amended, otherwise known as the labor code of the philippines",2011-02-15,National,Approved by the President of the Philippines,"Ejercito-Estrada, Jinggoy P., Pangilinan, Francis N., Revilla Jr., Ramon A., Lapid, Manuel ""Lito"" M., Legarda, Loren B., Defensor Santiago, Miriam, Villar, Manny B.",2011-06-21,True,Jinggoy Ejercito-Estrada,PMP,Majority,7.0,7,126.0,False,2,1.0,True,True,248
6213,15SBN-2640,SBN-2640,15,an act to promote financial viability and fiscal discipline in government-owned or controlled corporations and to strengthen the role of the state in its governance and management to make them more responsive to the needs of public interest and for other purposes,2011-01-18,National,Approved by the President of the Philippines,"Drilon, Franklin M., Angara, Edgardo J., Recto, Ralph G., Revilla Jr., Ramon A., Villar, Manny B.",2011-06-06,True,Franklin Drilon,Liberal,Minority,16.0,5,139.0,False,1,1.0,True,False,263
6228,15SBN-2625,SBN-2625,15,"an act amending republic act no. 9208, entitled 'an act to institute policies to eliminate trafficking in persons especially women and children, establishing the necessary institutional mechanisms for the protection and support of trafficked persons, providing penalties for its violations, and for other purposes', otherwise known as the anti-trafficking in persons act of 2003",2010-12-13,National,Consolidated with Approved Bill,"Trillanes, Antonio ""Sonny"" F., Legarda, Loren B., Cayetano, Pia S., Marcos, Ferdinand ""Bongbong"" R., Drilon, Franklin M., Ejercito-Estrada, Jinggoy P., Lapid, Manuel ""Lito"" M., Revilla Jr., Ramon A., Villar, Manny B.",2013-02-06,True,Antonio Trillanes IV,Nacionalista,Minority,6.0,9,786.0,True,12,4.0,True,False,378
6314,15SBN-2539,SBN-2539,15,"an act creating fifteen additional branches of the regional trial court and nine additional branches of the municipal trial court in the fourth judicial region to be stationed at various municipalities and cities in the province of cavite, further amending for the purpose batas pambansa bilang 129, otherwise known as the judiciary reorganization act of 1980, as amended, and appropriating funds therefor",2010-09-28,National,Approved by the President of the Philippines,"Revilla Jr., Ramon A.",2013-04-08,True,Ramon Revilla Jr,Lakas,Majority,9.0,1,923.0,True,9,3.0,True,True,405
6367,15SBN-2486,SBN-2486,15,"an act to strengthen and propagate foster care for abused, abandoned, neglected and other children with special needs, providing appropriations therefor and for other purposes",2010-09-07,National,Approved by the President of the Philippines,"Ejercito-Estrada, Jinggoy P., Villar, Manny B., Cayetano, Pia S., Pangilinan, Francis N., Recto, Ralph G., Drilon, Franklin M., Revilla Jr., Ramon A., Lapid, Manuel ""Lito"" M., Pimentel, Aquilino Koko III L.",2012-06-11,True,Jinggoy Ejercito-Estrada,PMP,Majority,8.0,9,643.0,True,9,3.0,True,True,175
6476,15SBN-2377,SBN-2377,15,"an act amending sections 1 and 4 of republic act no. 9340, resetting the barangay and sangguniang kabataan elections, and for other purposes",2010-08-10,National,Sent to the Archives,"Marcos, Ferdinand ""Bongbong"" R.",2010-09-06,False,Bongbong Marcos,Nacionalista,Majority,0.0,1,27.0,False,8,3.0,True,True,140
6596,15SBN-2257,SBN-2257,15,"an act amending republic act no. 8049, also known as the anti-hazing law of 1995, section 4 on the penalties for the violation of the act",2010-08-02,National,Sent to the Archives,"Defensor Santiago, Miriam",2013-06-06,False,Miriam Santiago,PRP,Minority,18.0,1,1039.0,True,8,3.0,True,False,137
6773,15SBN-2080,SBN-2080,15,an act declaring november twenty-five of every year as “national consciousness day for the elimination of violence againts women,2010-07-27,National,Approved by the President of the Philippines,"Cayetano, Pia S.",2013-03-19,True,Pilar Juliana CayetanoP,Nacionalista,Minority,9.0,1,966.0,True,7,3.0,True,False,128
7050,15SBN-1803,SBN-1803,15,"an act penalizing the failure to report acts of hazing, amending republic act no. 8049",2010-07-21,National,Sent to the Archives,"Defensor Santiago, Miriam",2013-06-06,False,Miriam Santiago,PRP,Minority,18.0,1,1051.0,True,7,3.0,True,False,86
7655,15SBN-1198,SBN-1198,15,an act providing for absentee voting by the members of media who are away from the places of their registration by reason of official functions on election day,2010-07-12,National,Approved by the President of the Philippines,"Villar, Manny B.",2013-03-14,True,Mannuel Villar Jr,Independent,Majority,9.0,1,976.0,True,7,3.0,True,True,159
7823,15SBN-1030,SBN-1030,15,"an act requiring all registered voters whose biometrics have not been captured to appear before the election officer of their place of registration for purposes of having their photographs, fingerprints and signatures captured through the method of biometrics, for purposes of ensuring that the automated fingerprint identification system (afis) can be utilized to cleanse the records of double or multiple registrants",2010-07-08,National,Approved by the President of the Philippines,"Lapid, Manuel ""Lito"" M.",2013-02-15,True,Lito Lapid,Lakas,Majority,9.0,1,953.0,True,7,3.0,True,True,418
8309,15SBN-544,SBN-544,15,"an act increasing pensions under the social security system amending for the purpose section 12 of republic act no. 1161, otherwise known as the social security act of 1997",2010-07-07,National,Sent to the Archives,"Ejercito-Estrada, Jinggoy P.",2013-06-06,False,Jinggoy Ejercito-Estrada,PMP,Majority,9.0,1,1065.0,True,7,3.0,True,True,172
8715,15SBN-138,SBN-138,15,"an act requiring  mandatory basic immunization services against hepatitis-b for infants, amending for the purpose presidential decree no. 996 as amended, and appropriating funds therefor",2010-07-05,National,Approved by the President of the Philippines,"Cayetano, Pia S., Legarda, Loren B., Ejercito-Estrada, Jinggoy P., Cayetano, Alan Peter Companero S.",2011-06-21,True,Pilar Juliana CayetanoP,Nacionalista,Minority,7.0,4,351.0,False,7,3.0,True,False,186
8775,15SBN-78,SBN-78,15,"an act providing for additional benefits and protection to the househelpers thereby amending for this purpose articles 141, 142, 143, 148, and 151 of chapter iii of p.d. 442, as amended, otherwise known as the labor code of the philippines",2010-07-01,National,Approved by the President of the Philippines,"Ejercito-Estrada, Jinggoy P., Cayetano, Alan Peter Companero S., Revilla Jr., Ramon A., Honasan II, Gregorio B., Sotto III, Vicente C.",2013-01-18,True,Jinggoy Ejercito-Estrada,PMP,Majority,9.0,5,932.0,True,7,3.0,True,True,239
8793,15SBN-60,SBN-60,15,"an act amending republic act no. 9340, resetting the synchronized barangay and sangguniang kabataan elections, and for other purposes",2010-07-01,National,Sent to the Archives,"Zubiri, Juan Miguel F.",2010-09-06,False,Juan Miguel Zubiri,Independent,Majority,3.0,1,67.0,False,7,3.0,True,True,133
8876,14SBN-3573,SBN-3573,14,"an act strengthening the literacy coordinating council by amending republic act no. 7165, otherwise known as an act creating the literacy coordinating council, defining its powers and functions, appropriating funds therefor and for other purposes",2010-01-27,National,Approved by the President of the Philippines,"Villar, Manny, Cayetano, Alan Peter ""Companero"" S., Angara, Edgardo J., Roxas, Mar",2010-05-27,True,Mannuel Villar Jr,Independent,Majority,9.0,4,120.0,False,1,1.0,True,True,246
8882,14SBN-3567,SBN-3567,14,"an act providing for the payment of survivorship benefits to the surviving legitimate spouse of a deceased retired member of the commission on audit, civil service commission, commission on elections, and the ombudsman and for other purposes",2010-01-18,National,Consolidated with Approved Bill,"Lacson, Panfilo M., Escudero, Francis ""Chiz"" G., Gordon, Richard ""Dick"" J., Zubiri, Juan Miguel F., Lapid, Manuel ""Lito"" M., Villar, Manny, Trillanes IV, Antonio ""Sonny"" F.",2010-05-05,True,Panfilo Lacson,Independent,Majority,9.0,7,107.0,False,1,1.0,True,True,241
8888,14SBN-3561,SBN-3561,14,"an act granting additional benefits and privileges to senior citizens, further amending republic act no. 7432, as amended, otherwise known as",2009-12-16,National,Approved by the President of the Philippines,"Legarda, Loren B., Lapid, Manuel ""Lito"" M., Defensor Santiago, Miriam, Angara, Edgardo J., Villar, Manny, Trillanes IV, Antonio ""Sonny"" F., Roxas, Mar, Revilla Jr., Ramon A., Cayetano, Alan Peter ""Companero"" S., Cayetano, ""Companera"" Pia S., Aquino III, Benigno S., Arroyo, Joker P., Biazon, Rodolfo G., Ejercito-Estrada, Jinggoy P., Enrile, Juan Ponce, Escudero, Francis ""Chiz"" G., Gordon, Richard ""Dick"" J., Honasan II, Gregorio B., Lacson, Panfilo M., Madrigal, M. A., Pangilinan, Francis N., Pimentel Jr., Aquilino Q., Zubiri, Juan Miguel F.",2010-02-15,True,Loren Legarda,NPC,Majority,12.0,23,61.0,False,12,4.0,True,True,141
8889,14SBN-3560,SBN-3560,14,magna carta for disabled persons,2009-12-16,National,Approved by the President of the Philippines,"Pangilinan, Francis N., Legarda, Loren B., Gordon, Richard ""Dick"" J., Villar, Manny, Trillanes IV, Antonio ""Sonny"" F., Cayetano, ""Companera"" Pia S., Zubiri, Juan Miguel F., Enrile, Juan Ponce, Ejercito-Estrada, Jinggoy P., Pimentel Jr., Aquilino Q., Cayetano, Alan Peter ""Companero"" S., Madrigal, M. A.",2010-04-06,True,Francis Pangilinan,Liberal,Minority,9.0,12,111.0,False,12,4.0,True,False,32
8920,14SBN-3529,SBN-3529,14,"an act to prohibit and penalize the unauthorized use, possession and/or control of audiovisual recording devices for the unauthorized recording of cinematographic films and other audiovisual works and/or their soundtracks in an exhibition facility, providing penalties therefor and for other purposes",2009-11-11,National,Approved by the President of the Philippines,"Defensor Santiago, Miriam, Ejercito-Estrada, Jinggoy P., Roxas, Mar, Cayetano, Alan Peter ""Companero"" S.",2010-05-13,True,Miriam Santiago,PRP,Majority,15.0,4,183.0,False,11,4.0,True,True,300
8947,14SBN-3502,SBN-3502,14,"an act reducing the tax insurance premium under certain conditions, amending for this purpose section 123 of the national internal revenue code, as amended",2009-10-15,National,Consolidated with Approved Bill,"Ejercito-Estrada, Jinggoy P., Legarda, Loren B., Angara, Edgardo J., Lacson, Panfilo M.",2010-02-23,True,Jinggoy Ejercito-Estrada,PMP,Majority,6.0,4,131.0,False,10,4.0,True,True,155
8950,14SBN-3499,SBN-3499,14,"an act regulating the practice of respiratory therapy, creating a professional regulatory board of respiratory therapy, appropriating funds therefor and for other purposes",2009-10-14,National,Approved by the President of the Philippines,"Trillanes IV, Antonio ""Sonny"" F., Angara, Edgardo J., Roxas, Mar, Revilla Jr., Ramon A., Lacson, Panfilo M.",2010-03-09,True,Antonio Trillanes IV,Independent,Minority,3.0,5,146.0,False,10,4.0,True,False,171
8951,14SBN-3498,SBN-3498,14,"an act to regulate the practice of psychology creating for this purpose a professional regulatory board of psychology, appropriating funds therefor and for other purposes",2009-10-14,National,Approved by the President of the Philippines,"Pimentel Jr., Aquilino Q., Trillanes IV, Antonio ""Sonny"" F., Legarda, Loren B., Lacson, Panfilo M.",2010-03-16,True,Aquilino Pimentel Jr,PDP-Laban,Minority,23.0,4,153.0,False,10,4.0,True,False,170
8953,14SBN-3496,SBN-3496,14,"an act creating the mindanao economic development authority (meda), defining its powers and functions, providing funds therefor and for other purposes",2009-10-14,National,Consolidated with Approved Bill,"Zubiri, Juan Miguel F., Defensor Santiago, Miriam, Villar, Manny, Lapid, Manuel ""Lito"" M., Ejercito-Estrada, Jinggoy P., Gordon, Richard ""Dick"" J., Revilla Jr., Ramon A., Roxas, Mar, Legarda, Loren B., Angara, Edgardo J., Cayetano, ""Companera"" Pia S., Enrile, Juan Ponce",2010-02-17,True,Juan Miguel Zubiri,Lakas-Kampi-CMD,Majority,3.0,12,126.0,False,10,4.0,True,True,150
8967,14SBN-3482,SBN-3482,14,"an act creating the national commission on muslim filipinos defining its powers, functions and responsibilities and appropriating funds therefor and for other purposes",2009-10-13,National,Approved by the President of the Philippines,"Ejercito-Estrada, Jinggoy P., Legarda, Loren B., Pimentel Jr., Aquilino Q., Zubiri, Juan Miguel F., Madrigal, M. A., Lacson, Panfilo M., Angara, Edgardo J., Enrile, Juan Ponce",2010-02-18,True,Jinggoy Ejercito-Estrada,PMP,Majority,6.0,8,128.0,False,10,4.0,True,True,167
8977,14SBN-3472,SBN-3472,14,"an act strengthening peoples' nationalism through philippine history by changing the nomenclature of the national historical institute into the national historical commission of the philippines, strengthening its powers and functions, and for other purposes",2009-10-07,National,Approved by the President of the Philippines,"Angara, Edgardo J., Roxas, Mar",2010-05-12,True,Eduardo Angara,LDP,Majority,6.0,2,217.0,False,10,4.0,True,True,257
8979,14SBN-3470,SBN-3470,14,"an act amending republic act no. 9490, otherwise known as the aurora special economic zone act of 2007",2009-10-06,National,Lapsed Into Law,"Angara, Edgardo J., Defensor Santiago, Miriam",2010-04-22,True,Eduardo Angara,LDP,Majority,6.0,2,198.0,False,10,4.0,True,True,102
9006,14SBN-3443,SBN-3443,14,"an act creating five (5) additional branches of the regional trial courts  in the eleventh judicial region to be stationed at the municipality of alabel, province of sarangani, amending for the purpose paragraph (l),  section 14 of batas pambansa bilang 129, as amended,  otherwise known as the 'judiciary reorganization act of 1980'.",2009-09-17,Local,Consolidated with Approved Bill,"Escudero, Francis ""Chiz"" G., Angara, Edgardo J.",2010-06-03,True,Francis Escudero,Independent,Majority,3.0,2,259.0,False,9,3.0,False,True,334
9008,14SBN-3441,SBN-3441,14,"an act creating five additional branches of the regional trial court and eleven additional branches of the metropolitan trial court in the national capital judicial region to be stationed at mandaluyong city, further amending for the purpose batas pambansa bilang 129, otherwise known as 'the judiciary reorganization act of 1980', as amended, and appropriating funds therefor",2009-09-17,Local,Approved by the President of the Philippines,"Escudero, Francis ""Chiz"" G., Angara, Edgardo J.",2009-12-11,True,Francis Escudero,Independent,Majority,2.0,2,85.0,False,9,3.0,False,True,376
9018,14SBN-3431,SBN-3431,14,an act providing for an agriculture and agrarian reform credit and financing system through banking institutions,2009-09-09,National,Approved by the President of the Philippines,"Legarda, Loren B., Ejercito-Estrada, Jinggoy P., Revilla Jr., Ramon A., Biazon, Rodolfo G., Villar, Manny",2010-02-23,True,Loren Legarda,NPC,Majority,12.0,5,167.0,False,9,3.0,True,True,112
9020,14SBN-3429,SBN-3429,14,an act reforming the administrative titling process by amending certain provisions of commonwealth act no. 141 otherwise known as the public land act as amended,2009-09-08,National,Consolidated with Approved Bill,"Defensor Santiago, Miriam, Honasan II, Gregorio B., Gordon, Richard ""Dick"" J., Zubiri, Juan Miguel F., Ejercito-Estrada, Jinggoy P., Legarda, Loren B., Roxas, Mar, Escudero, Francis ""Chiz"" G., Madrigal, M. A.",2010-03-09,True,Miriam Santiago,PRP,Majority,15.0,9,182.0,False,9,3.0,True,True,160
9033,14SBN-3416,SBN-3416,14,"an act providing the framework and support system for the ownership, management, use, and commercialization of intellectual property generated from research and development funded by government and for other purposes",2009-08-26,National,Approved by the President of the Philippines,"Angara, Edgardo J., Legarda, Loren B., Roxas, Mar, Honasan II, Gregorio B., Arroyo, Joker P., Cayetano, ""Companera"" Pia S., Lacson, Panfilo M., Pimentel Jr., Aquilino Q., Ejercito-Estrada, Jinggoy P., Zubiri, Juan Miguel F.",2010-03-23,True,Eduardo Angara,LDP,Majority,6.0,10,209.0,False,8,3.0,True,True,216
9053,14SBN-3396,SBN-3396,14,"an act amending republic act no. 9280, otherwise known as the customs brokers act of 2004 and for other purposes",2009-08-18,National,Approved by the President of the Philippines,"Roxas, Mar, Gordon, Richard ""Dick"" J., Villar, Manny, Lacson, Panfilo M.",2009-12-15,True,Manuel Roxas,Liberal,Majority,5.0,4,119.0,False,8,3.0,True,True,112
9057,14SBN-3392,SBN-3392,14,"an act granting income tax exemption to local water districts, amending for the purpose section 27 (c) of the national internal revenue code, as amended",2009-08-17,National,Consolidated with Approved Bill,"Lacson, Panfilo M., Escudero, Francis ""Chiz"" G., Aquino III, Benigno S., Arroyo, Joker P., Biazon, Rodolfo G., Ejercito-Estrada, Jinggoy P., Gordon, Richard ""Dick"" J., Honasan II, Gregorio B., Pimentel Jr., Aquilino Q., Roxas, Mar, Zubiri, Juan Miguel F.",2010-03-11,True,Panfilo Lacson,Independent,Majority,9.0,11,206.0,False,8,3.0,True,True,152
9060,14SBN-3389,SBN-3389,14,"an act establishing the philippine coast guard as an armed and uniformed service attached to the department of transportation and communications, thereby repealing republic act no. 5173, as amended, and for other purposes",2009-08-13,National,Approved by the President of the Philippines,"Biazon, Rodolfo G., Ejercito-Estrada, Jinggoy P., Pimentel Jr., Aquilino Q., Escudero, Francis ""Chiz"" G., Gordon, Richard ""Dick"" J., Trillanes IV, Antonio ""Sonny"" F., Defensor Santiago, Miriam, Lacson, Panfilo M., Angara, Edgardo J.",2010-02-12,True,Rodolfo Biazon,Liberal,Majority,12.0,9,183.0,False,8,3.0,True,True,221
9151,14SBN-3298,SBN-3298,14,"an act instituting the new girl scouts of the philippines charter, penalizing violations thereof, and for other purposes",2009-06-01,National,Approved by the President of the Philippines,"Revilla Jr., Ramon A., Legarda, Loren B., Defensor Santiago, Miriam, Escudero, Francis ""Chiz"" G., Zubiri, Juan Miguel F., Gordon, Richard ""Dick"" J., Lacson, Panfilo M., Arroyo, Joker P.",2010-04-20,True,Ramon Revilla Jr,Lakas-Kampi-CMD,Majority,6.0,8,323.0,False,6,2.0,True,True,120
9161,14SBN-3288,SBN-3288,14,an act declaring arnis as the national sport of the philippines,2009-05-28,National,Approved by the President of the Philippines,"Lapid, Manuel ""Lito"" M., Zubiri, Juan Miguel F., Roxas, Mar, Arroyo, Joker P., Pimentel Jr., Aquilino Q.",2009-12-11,True,Lito Lapid,Lakas-Kampi-CMD,Majority,5.0,5,197.0,False,5,2.0,True,True,63
9163,14SBN-3286,SBN-3286,14,"an act amending republic act no. 8042, otherwise known as the migrant workers act of 1995, as amended, further improving the standard of protection and promotion of the welfare of migrant workers, their families and overseas filipino workers in distress and for other purposes",2009-05-27,National,Lapsed Into Law,"Lapid, Manuel ""Lito"" M., Gordon, Richard ""Dick"" J., Ejercito-Estrada, Jinggoy P., Villar, Manny, Revilla Jr., Ramon A., Defensor Santiago, Miriam, Angara, Edgardo J.",2010-03-08,True,Lito Lapid,Lakas-Kampi-CMD,Majority,6.0,7,285.0,False,5,2.0,True,True,276
9164,14SBN-3285,SBN-3285,14,"an act amending republic act no. 95, otherwise known as 'an act to incorporate the philippine national red cross, as amended', and for other purposes",2009-05-27,National,Approved by the President of the Philippines,"Gordon, Richard ""Dick"" J., Zubiri, Juan Miguel F., Escudero, Francis ""Chiz"" G., Biazon, Rodolfo G., Lacson, Panfilo M.",2010-04-20,True,Richard Gordon,Bagumbayan-VNP,Majority,6.0,5,328.0,False,5,2.0,True,True,149
9166,14SBN-3283,SBN-3283,14,"an act declaring the tenth day of zhul hijja, the twelfth month of the islamic calendar, a national holiday for the observance of eidul adha, amending for the purpose section 26, chapter 7 of executive order no. 292, otherwise known as the administrative code of 1987, as amended and for other purposes",2009-05-27,National,Approved by the President of the Philippines,"Legarda, Loren B., Zubiri, Juan Miguel F., Escudero, Francis ""Chiz"" G.",2009-12-11,True,Loren Legarda,NPC,Majority,11.0,3,198.0,False,5,2.0,True,True,302
9168,14SBN-3281,SBN-3281,14,"an act declaring july 27 of every year as a special national working holiday in recognition of the founding anniversary of the iglesia ni cristo in the philippines, amending for the purpose section 26, chapter 7, of executive order no. 292, otherwise known as the administrative code of 1987, as amended",2009-05-27,National,Consolidated with Approved Bill,"Revilla Jr., Ramon A., Zubiri, Juan Miguel F., Escudero, Francis ""Chiz"" G., Lapid, Manuel ""Lito"" M.",2009-06-12,True,Ramon Revilla Jr,Lakas-Kampi-CMD,Majority,5.0,4,16.0,False,5,2.0,True,True,303
9174,14SBN-3275,SBN-3275,14,"an act amending republic act no. 5412, as amended, otherwise known as the charter of the city of general santos",2009-05-25,Local,Consolidated with Approved Bill,"Escudero, Francis ""Chiz"" G., Aquino III, Benigno S., Roxas, Mar, Zubiri, Juan Miguel F.",2009-07-07,True,Francis Escudero,Independent,Majority,2.0,4,43.0,False,5,2.0,False,True,111
9185,14SBN-3264,SBN-3264,14,an act providing for the development and promotion of organic agriculture in the philippines and for other purposes,2009-05-19,National,Approved by the President of the Philippines,"Ejercito-Estrada, Jinggoy P., Biazon, Rodolfo G., Legarda, Loren B., Zubiri, Juan Miguel F., Villar, Manny, Angara, Edgardo J.",2010-04-06,True,Jinggoy Ejercito-Estrada,PMP,Majority,6.0,6,322.0,False,5,2.0,True,True,115
