2835,16SBN-2622,SBN-2622,16,"an act amending republic act no. 9367, otherwise known as the biofuels act of 2006",2015-02-02,National,Lapsed Into Law,"Osmena III, Sergio R.",2016-02-26,True,Sergio Osmena III,Independent,Majority,21.0,1,389.0,True,2,1.0,True,True,82
2875,16SBN-2582,SBN-2582,16,"an act regulating the practice of nutrition and dietetics in the philippines, repealing for the purpose presidential decree no. 1286, known as the 'nutrition and dietetics decree of 1977', appropriating funds therefor and for other related purposes",2015-01-22,National,Approved by the President of the Philippines,"Trillanes, Antonio ""Sonny"" F., Villar, Cynthia A., Escudero, Francis ""Chiz"" G.",2016-05-25,True,Antonio Trillanes IV,Nacionalista,Majority,9.0,3,489.0,True,1,1.0,True,True,248
2876,16SBN-2581,SBN-2581,16,"an act mandating and strengthening the continuing professional development program for all regulated professions, creating continuing professional development council, and appropriating funds therefor, and for other related purposes",2015-01-22,National,Lapsed Into Law,"Trillanes, Antonio ""Sonny"" F., Villar, Cynthia A., Escudero, Francis ""Chiz"" G.",2016-06-30,True,Antonio Trillanes IV,Nacionalista,Majority,9.0,3,525.0,True,1,1.0,True,True,232
2952,16SBN-2504,SBN-2504,16,an act requiring multi-hazard maps and flood hazard maps in every local government unit and for other purposes,2014-12-09,National,Sent to the Archives,"Lapid, Manuel ""Lito"" M.",2015-12-08,False,Lito Lapid,Independent,Majority,11.0,1,364.0,False,12,4.0,True,True,110
2968,16SBN-2488,SBN-2488,16,an act to ensure the safety of children aboard two-wheeled motorcycles travelling along public and private roads,2014-12-04,National,Approved by the President of the Philippines,"Sotto III, Vicente C., Revilla Jr., Ramon A., Villar, Cynthia A., Ejercito, Joseph Victor G., Honasan II, Gregorio B.",2015-07-21,True,Tito Sotto III,NPC,Majority,23.0,5,229.0,False,12,4.0,True,True,112
2970,16SBN-2486,SBN-2486,16,"an act exempting the carriage of container vans from the provisions of section 1009 of presidential decree no. 1464, otherwise known as the tariff and customs code of 1978, and for other purposes",2014-12-03,National,Approved by the President of the Philippines,"Trillanes, Antonio ""Sonny"" F., Ejercito-Estrada, Jinggoy P., Poe, Grace L., Aquino IV, Paolo Benigno ""Bam"", Villar, Cynthia A.",2015-07-21,True,Antonio Trillanes IV,Nacionalista,Majority,8.0,5,230.0,False,12,4.0,True,True,195
2974,16SBN-2482,SBN-2482,16,an act to regulate and modernize the practice of naval architecture in the philippines,2014-12-01,National,Approved by the President of the Philippines,"Drilon, Franklin M.",2015-11-13,True,Franklin Drilon,Liberal,Majority,20.0,1,347.0,False,12,4.0,True,True,86
2975,16SBN-2481,SBN-2481,16,"an act to improve the facilities of northern mindanao medical center, amending for the purpose republic act no. 7938, appropriating funds therefor and for other purposes",2014-12-01,National,Approved by the President of the Philippines,"Poe, Grace L., Guingona III, Teofisto ""Tg""",2015-08-26,True,Grace Poe,Independent,Majority,2.0,2,268.0,False,12,4.0,True,True,169
3019,16SBN-2437,SBN-2437,16,"an act adjusting the 13th month pay and other benefits ceiling excluded from the computation of gross income for purposes of income taxation, amending for the purpose section 32 (b), chapter vi of the national internal revenue code of 1997, as amended",2014-10-22,National,Consolidated with Approved Bill,"Recto, Ralph G., Lapid, Manuel ""Lito"" M., Angara, Juan Edgardo ""Sonny"" M., Villar, Cynthia A., Legarda, Loren B., Aquino IV, Paolo Benigno ""Bam"", Cayetano, Alan Peter Companero S., Cayetano, Pia S., Drilon, Franklin M., Ejercito, Joseph Victor G., Escudero, Francis ""Chiz"" G., Guingona III, Teofisto ""Tg"", Honasan II, Gregorio B., Osmena III, Sergio R., Pimentel, Aquilino Koko III L., Sotto III, Vicente C., Trillanes, Antonio ""Sonny"" F., Binay, Maria Lourdes Nancy S., Poe, Grace L.",2015-02-12,True,Ralph Recto,Liberal,Majority,14.0,19,113.0,False,10,4.0,True,True,251
3020,16SBN-2436,SBN-2436,16,"an act to regulate and modernize the practice of pharmacy in the philippines, and for other purposes",2014-10-20,National,Consolidated with Approved Bill,"Ejercito-Estrada, Jinggoy P., Escudero, Francis ""Chiz"" G., Trillanes, Antonio ""Sonny"" F.",2016-06-30,True,Jinggoy Ejercito-Estrada,PMP,Minority,12.0,3,619.0,True,10,4.0,True,False,100
3022,16SBN-2434,SBN-2434,16,"an act strengthening, modernizing and aligning the practice of agricultural engineering in the country into the internationally recognized practice of agricultural and biosystems engineering, and for other purposes",2014-10-15,National,Lapsed Into Law,"Trillanes, Antonio ""Sonny"" F., Villar, Cynthia A.",2016-06-30,True,Antonio Trillanes IV,Nacionalista,Majority,9.0,2,624.0,True,10,4.0,True,True,214
3034,16SBN-2422,SBN-2422,16,"an act increasing the prescriptive period for violations of republic act no. 3019, otherwise known as 'the anti-graft and corrupt practices act', from fifteen (15) years to twenty (20) years, amending section 11 thereof",2014-09-23,National,Lapsed Into Law,"Guingona III, Teofisto ""Tg"", Ejercito-Estrada, Jinggoy P., Pimentel, Aquilino Koko III L.",2016-06-30,True,Teofisto Guingona III,Liberal,Majority,6.0,3,646.0,True,9,3.0,True,True,219
3042,16SBN-2414,SBN-2414,16,"an act strengthening the regulatory and enforcement functions of the bureau of fisheries and aquatic resources, amending for the purpose republic act no. 8550, otherwise known as 'the philippine fisheries code of 1998,' and for other purposes",2014-09-17,National,Lapsed Into Law,"Villar, Cynthia A., Legarda, Loren B., Revilla Jr., Ramon A., Lapid, Manuel ""Lito"" M., Ejercito-Estrada, Jinggoy P., Poe, Grace L., Defensor Santiago, Miriam, Cayetano, Alan Peter Companero S., Sotto III, Vicente C.",2015-02-27,True,Cynthia Villar,Nacionalista,Majority,2.0,9,163.0,False,9,3.0,True,True,242
3055,16SBN-2401,SBN-2401,16,"an act establishing enabling mechanisms for meaningful youth participation in nation building, strengthening the sangguniang kabataan, creating the municipal, city and provincial youth development councils, and for other purposes",2014-09-09,National,Approved by the President of the Philippines,"Ejercito, Joseph Victor G., Aquino IV, Paolo Benigno ""Bam"", Marcos, Ferdinand ""Bongbong"" R., Pimentel, Aquilino Koko III L., Escudero, Francis ""Chiz"" G., Villar, Cynthia A., Revilla Jr., Ramon A.",2016-01-15,True,JV Ejercito,PMP,Minority,3.0,7,493.0,True,9,3.0,True,False,229
3056,16SBN-2400,SBN-2400,16,"an act promoting and supporting the competitiveness of the sugarcane industry, establishing the sugarcane industry development fund, and for other purposes",2014-09-08,National,Approved by the President of the Philippines,"Binay, Maria Lourdes Nancy S., Escudero, Francis ""Chiz"" G., Villar, Cynthia A., Trillanes, Antonio ""Sonny"" F., Ejercito, Joseph Victor G., Honasan II, Gregorio B., Legarda, Loren B., Poe, Grace L.",2015-03-27,True,Nancy Binay,UNA,Minority,2.0,8,200.0,False,9,3.0,True,False,155
3174,16SBN-2282,SBN-2282,16,"an act promoting fair competition to protect consumer welfare, advance domestic and international trade and sustained economic development by, among others, regulating monopolies, anti-competitive agreements, abuse of dominant position, and anti-competitive mergers, establishing the fair competition commission and appropriating funds therefor, and for other purposes",2014-06-16,National,Approved by the President of the Philippines,"Osmena III, Sergio R., Guingona III, Teofisto ""Tg"", Defensor Santiago, Miriam, Ejercito-Estrada, Jinggoy P., Trillanes, Antonio ""Sonny"" F., Aquino IV, Paolo Benigno ""Bam""",2015-07-21,True,Sergio Osmena III,Independent,Majority,20.0,6,400.0,True,6,2.0,True,True,368
3176,16SBN-2280,SBN-2280,16,"an act amending presidential decree no. 968, otherwise known as the probation law of 1976, as amended",2014-06-11,National,Approved by the President of the Philippines,"Escudero, Francis ""Chiz"" G., Defensor Santiago, Miriam, Ejercito, Joseph Victor G., Pimentel, Aquilino Koko III L.",2015-11-26,True,Francis Escudero,Independent,Majority,8.0,4,533.0,True,6,2.0,True,True,101
3179,16SBN-2277,SBN-2277,16,an act establishing the open high school system in the philippines and appropriating funds therefor,2014-06-09,National,Approved by the President of the Philippines,"Revilla Jr., Ramon A., Defensor Santiago, Miriam, Angara, Juan Edgardo ""Sonny"" M., Recto, Ralph G., Villar, Cynthia A., Sotto III, Vicente C.",2015-07-09,True,Ramon Revilla Jr,Lakas,Minority,11.0,6,395.0,True,6,2.0,True,False,99
3181,16SBN-2275,SBN-2275,16,"an act mandating all state colleges and universities to annually confer automatic admission and provide scholarship grants to the top ten (10) public high school students of their graduating class, and allocate funds therefor",2014-06-04,National,Approved by the President of the Philippines,"Cayetano, Alan Peter Companero S., Cayetano, Pia S., Villar, Cynthia A.",2014-11-27,True,Alan Peter Cayetano,Nacionalista,Majority,7.0,3,176.0,False,6,2.0,True,True,225
3182,16SBN-2274,SBN-2274,16,"an act to expand access to education through open learning and distance education in tertiary levels of education, appropriating funds therefore and for other purposes",2014-06-04,National,Approved by the President of the Philippines,"Villar, Cynthia A., Recto, Ralph G., Trillanes, Antonio ""Sonny"" F., Defensor Santiago, Miriam, Ejercito-Estrada, Jinggoy P., Angara, Juan Edgardo ""Sonny"" M., Cayetano, Pia S.",2014-12-09,True,Cynthia Villar,Nacionalista,Majority,1.0,7,188.0,False,6,2.0,True,True,167
3183,16SBN-2273,SBN-2273,16,"an act to further strengthen the anti-drug campaign of the government, amending for the purpose section 21 of republic act no. 9165, otherwise known as the comprehensive dangerous drugs act of 2002",2014-06-04,National,Consolidated with Approved Bill,"Sotto III, Vicente C., Honasan II, Gregorio B., Ejercito, Joseph Victor G., Ejercito-Estrada, Jinggoy P., Poe, Grace L.",2014-07-15,True,Tito Sotto III,NPC,Majority,22.0,5,41.0,False,6,2.0,True,True,197
3184,16SBN-2272,SBN-2272,16,an act strengthening the ladderized interface between technical-vocational education and training and higher education,2014-06-03,National,Approved by the President of the Philippines,"Villar, Cynthia A., Recto, Ralph G., Angara, Juan Edgardo ""Sonny"" M., Cayetano, Pia S.",2014-11-21,True,Cynthia Villar,Nacionalista,Majority,1.0,4,171.0,False,6,2.0,True,True,118
3213,16SBN-2243,SBN-2243,16,an act providing for the legal framework to govern special use agreements in protected areas,2014-05-26,National,Sent to the Archives,"Binay, Maria Lourdes Nancy S.",2015-12-08,False,Nancy Binay,UNA,Minority,2.0,1,561.0,True,5,2.0,True,False,92
3214,16SBN-2242,SBN-2242,16,"an act expanding the list of prohibited activities in protected areas, increasing the penalty for violations thereof and amending for these purposes republic act no. 7586, otherwise known as the national integrated protected areas act of 1992 (nipas act of 1992)",2014-05-26,National,Sent to the Archives,"Binay, Maria Lourdes Nancy S.",2015-12-08,False,Nancy Binay,UNA,Minority,2.0,1,561.0,True,5,2.0,True,False,262
3217,16SBN-2239,SBN-2239,16,"an act requiring all franchise holders or operators of television stations and producers of television programs to broadcast or present their programs with closed captions option, and for other purposes",2014-05-26,National,Lapsed Into Law,"Revilla Jr., Ramon A., Legarda, Loren B., Poe, Grace L., Aquino IV, Paolo Benigno ""Bam"", Villar, Cynthia A.",2016-06-30,True,Ramon Revilla Jr,Lakas,Minority,12.0,5,766.0,True,5,2.0,True,False,202
3230,16SBN-2226,SBN-2226,16,an act protecting the amateur nature of student-athletes in the philippines by regulating the residency requirement and prohibiting the commercialization of student-athletes,2014-05-14,National,Approved by the President of the Philippines,"Defensor Santiago, Miriam, Cayetano, Pia S., Villar, Cynthia A., Angara, Juan Edgardo ""Sonny"" M., Guingona III, Teofisto ""Tg"", Legarda, Loren B., Aquino IV, Paolo Benigno ""Bam"", Escudero, Francis ""Chiz"" G., Marcos, Ferdinand ""Bongbong"" R., Binay, Maria Lourdes Nancy S., Pimentel, Aquilino Koko III L., Ejercito, Joseph Victor G., Recto, Ralph G., Cayetano, Alan Peter Companero S., Enrile, Juan Ponce",2015-08-26,True,Miriam Santiago,PRP,Majority,20.0,15,469.0,True,5,2.0,True,True,173
3244,16SBN-2212,SBN-2212,16,an act to actively promote entrepreneurship and financial education among filipino youth,2014-05-07,National,Approved by the President of the Philippines,"Villar, Cynthia A., Cayetano, Pia S., Angara, Juan Edgardo ""Sonny"" M., Aquino IV, Paolo Benigno ""Bam"", Defensor Santiago, Miriam, Poe, Grace L.",2015-08-27,True,Cynthia Villar,Nacionalista,Majority,2.0,6,477.0,True,5,2.0,True,True,88
3245,16SBN-2211,SBN-2211,16,an act strengthening consumer protection in the purchase of brand new motor vehicles and for other purposes,2014-05-06,National,Approved by the President of the Philippines,"Villar, Cynthia A., Ejercito-Estrada, Jinggoy P., Aquino IV, Paolo Benigno ""Bam"", Pimentel, Aquilino Koko III L.",2014-07-15,True,Cynthia Villar,Nacionalista,Majority,1.0,4,70.0,False,5,2.0,True,True,107
3278,16SBN-2178,SBN-2178,16,"an act making election service non-compulsory for public school teachers, authorizing the appointment of other qualified citizens, providing for compensation and other benefits, amending for the purpose the omnibus election code, republic act no. 6646, and other election laws",2014-03-26,National,Approved by the President of the Philippines,"Aquino IV, Paolo Benigno ""Bam"", Villar, Cynthia A.",2016-04-08,True,Bam Aquino,Liberal,Majority,3.0,2,744.0,True,3,1.0,True,True,276
3295,16SBN-2161,SBN-2161,16,"an act creating the quezon city development authority (qcda), defining its powers and functions, providing for its organizational structure and capitalization",2014-03-04,National,Lapsed Into Law,"Sotto III, Vicente C., Recto, Ralph G., Ejercito, Joseph Victor G.",2014-11-08,True,Tito Sotto III,NPC,Majority,22.0,3,249.0,False,3,1.0,True,True,158
3297,16SBN-2159,SBN-2159,16,"an act amending republic act no. 7721, otherwise known as an act liberalizing the entry and scope of operations of foreign banks in the philippines and for other purposes",2014-03-04,National,Approved by the President of the Philippines,"Osmena III, Sergio R., Villar, Cynthia A.",2014-07-15,True,Sergio Osmena III,Independent,Majority,19.0,2,133.0,False,3,1.0,True,True,170
3318,16SBN-2138,SBN-2138,16,"an act further amending presidential decree no. 1606, as amended",2014-02-24,National,Approved by the President of the Philippines,"Drilon, Franklin M., Guingona III, Teofisto ""Tg"", Pimentel, Aquilino Koko III L., Villar, Cynthia A.",2015-04-16,True,Franklin Drilon,Liberal,Majority,20.0,4,416.0,True,2,1.0,True,True,64
3326,16SBN-2130,SBN-2130,16,an act requiring the secretary of finance and the governor of the bangko sentral ng pilipinas to appear before congress quarterly to report on the status and directions of the fiscal and monetary policies of the state,2014-02-19,National,Sent to the Archives,"Ejercito, Joseph Victor G.",2014-08-11,False,JV Ejercito,PMP,Minority,1.0,1,173.0,False,2,1.0,True,False,217
3353,16SBN-2103,SBN-2103,16,"an act regulating the practice of metallurgical engineering in the philippines, repealing for this purpose presidential decree numbered 1536, otherwise known as the metallurgical engineering law of the philippines, and for other purposes",2014-02-05,National,Approved by the President of the Philippines,"Legarda, Loren B., Trillanes, Antonio ""Sonny"" F., Escudero, Francis ""Chiz"" G., Villar, Cynthia A.",2015-10-20,True,Loren Legarda,NPC,Majority,17.0,4,622.0,True,2,1.0,True,True,237
3401,16SBN-2055,SBN-2055,16,"an act regulating the practice of forestry in the philippines, repealing for the purpose republic act numbered sixty-two hundred thirty-nine, known as 'the forestry profession law', appropriating funds therefor and for other purposes",2014-01-15,National,Consolidated with Approved Bill,"Trillanes, Antonio ""Sonny"" F., Villar, Cynthia A.",2015-10-23,True,Antonio Trillanes IV,Nacionalista,Majority,8.0,2,646.0,True,1,1.0,True,True,233
3410,16SBN-2046,SBN-2046,16,"an act promoting the reduction of poverty through the development of micro, small and medium enterprises",2013-12-17,National,Approved by the President of the Philippines,"Osmena III, Sergio R., Recto, Ralph G., Aquino IV, Paolo Benigno ""Bam"", Defensor Santiago, Miriam, Ejercito-Estrada, Jinggoy P., Poe, Grace L., Villar, Cynthia A., Legarda, Loren B.",2014-07-15,True,Sergio Osmena III,Independent,Majority,19.0,8,210.0,False,12,4.0,True,True,104
3413,16SBN-2043,SBN-2043,16,"an act establishing the maritime industry authority (marina) as the single maritime administration responsible for the implementation and enforcement of the international convention on the standards of training, certification, and watchkeeping for seafarers, as amended, and international agreements or covenants related thereto",2013-12-16,National,Approved by the President of the Philippines,"Drilon, Franklin M., Trillanes, Antonio ""Sonny"" F., Angara, Juan Edgardo ""Sonny"" M., Aquino IV, Paolo Benigno ""Bam"", Binay, Maria Lourdes Nancy S., Cayetano, Alan Peter Companero S., Cayetano, Pia S., Ejercito, Joseph Victor G., Ejercito-Estrada, Jinggoy P., Enrile, Juan Ponce, Escudero, Francis ""Chiz"" G., Guingona III, Teofisto ""Tg"", Honasan II, Gregorio B., Lapid, Manuel ""Lito"" M., Legarda, Loren B., Osmena III, Sergio R., Pimentel, Aquilino Koko III L., Poe, Grace L., Recto, Ralph G., Revilla Jr., Ramon A., Sotto III, Vicente C., Villar, Cynthia A.",2014-03-13,True,Franklin Drilon,Liberal,Majority,19.0,22,87.0,False,12,4.0,True,True,328
3584,16SBN-1872,SBN-1872,16,"an act appropriating the sum of ten billion pesos for the aid, relief, resettlement, rehabilitation and livelihood services as well as infrastructure support for the victims of the earthquake in central visayas, creating the central visayas assistance, resettlement and development commission, and for other purposes",2013-10-22,National,Sent to the Archives,"Enrile, Juan Ponce",2014-06-02,False,Juan Ponce Enrile,PMP,Minority,27.0,1,223.0,False,10,4.0,True,False,316
3625,16SBN-1831,SBN-1831,16,"an act extending the corporate life of the philippine national railways for another fifty (50) years, further amending for this purpose republic act no. 4156, entitled 'an act creating the philippine national railways, prescribing its powers, functions and duties, and providing for the necessary funds for its operations', as amended",2013-10-09,National,Consolidated with Approved Bill,"Recto, Ralph G., Villar, Cynthia A., Escudero, Francis ""Chiz"" G., Cayetano, Pia S., Honasan II, Gregorio B., Cayetano, Alan Peter Companero S., Trillanes, Antonio ""Sonny"" F.",2014-06-16,True,Ralph Recto,Liberal,Majority,13.0,7,250.0,False,10,4.0,True,True,334
3809,16SBN-1647,SBN-1647,16,"an act repealing the crime of premature marriage under article 351 of act no. 3815, otherwise known as the revised penal code",2013-09-11,National,Approved by the President of the Philippines,"Binay, Maria Lourdes Nancy S., Villar, Cynthia A.",2015-03-13,True,Nancy Binay,UNA,Minority,2.0,2,548.0,True,9,3.0,True,False,125
3838,16SBN-1618,SBN-1618,16,an act requiring business establishments to give exact change to consumers,2013-09-10,National,Lapsed Into Law,"Defensor Santiago, Miriam",2016-06-30,True,Miriam Santiago,PRP,Majority,21.0,1,1024.0,True,9,3.0,True,True,74
3915,16SBN-1541,SBN-1541,16,"an act to direct the department of environment and natural resources, through the national mapping and resource information authority, together with the national disaster coordinating council, to identify low-lying areas of the philippine territory vulnerable to rising sea levels as a result of global warming, and areas at high risk for natural disasters, appropriating funds therefor and for other purposes",2013-09-05,National,Sent to the Archives,"Ejercito-Estrada, Jinggoy P.",2015-12-08,False,Jinggoy Ejercito-Estrada,PMP,Minority,11.0,1,824.0,True,9,3.0,True,False,409
3945,16SBN-1511,SBN-1511,16,"an act instituting line item budgeting in the budgetary process of the government, repealing for this purpose presidential decree 1177, as amended",2013-09-04,National,Sent to the Archives,"Ejercito-Estrada, Jinggoy P.",2014-08-11,False,Jinggoy Ejercito-Estrada,PMP,Minority,10.0,1,341.0,False,9,3.0,True,False,146
3947,16SBN-1509,SBN-1509,16,"an act amending republic act no. 9184, otherwise known as the government procurement reform act, withdrawing from its application all references to the local government units",2013-09-04,National,Sent to the Archives,"Ejercito-Estrada, Jinggoy P.",2014-08-11,False,Jinggoy Ejercito-Estrada,PMP,Minority,10.0,1,341.0,False,9,3.0,True,False,174
3948,16SBN-1508,SBN-1508,16,"an act authorizing the land management bureau to conduct a survey of cadastral lots in the entire country, and appropriating funds therefor",2013-09-04,National,Sent to the Archives,"Ejercito-Estrada, Jinggoy P.",2015-12-08,False,Jinggoy Ejercito-Estrada,PMP,Minority,11.0,1,825.0,True,9,3.0,True,False,139
3993,16SBN-1463,SBN-1463,16,"an act providing for a national ecotourism policy, establishing a framework for its institutionalization, providing the mechanisms for its appropriate implementations, and for other purposes",2013-09-03,National,Sent to the Archives,"Ejercito-Estrada, Jinggoy P.",2015-12-08,False,Jinggoy Ejercito-Estrada,PMP,Minority,11.0,1,826.0,True,9,3.0,True,False,190
4070,16SBN-1386,SBN-1386,16,"an act defining the role of the department of labor and employment (dole) and the local government units (lgus) in the establishment and operation of the public employment service office (peso), and the operation of job placement office in sucs and ngos, amending for the purpose sections 3, 6, 7, and 9 of republic act no. 8759, otherwise known as public employment service office act of 1999",2013-08-28,National,Consolidated with Approved Bill,"Ejercito-Estrada, Jinggoy P., Legarda, Loren B., Revilla Jr., Ramon A., Villar, Cynthia A., Angara, Juan Edgardo ""Sonny"" M., Cayetano, Alan Peter Companero S.",2015-10-26,True,Jinggoy Ejercito-Estrada,PMP,Minority,11.0,6,789.0,True,8,3.0,True,False,393
4175,16SBN-1281,SBN-1281,16,"an act declaring august 18 of every year as 'jesse robredo' day, a special working holiday, and for other purposes",2013-08-13,National,Approved by the President of the Philippines,"Guingona III, Teofisto ""Tg"", Pimentel, Aquilino Koko III L.",2015-08-18,True,Teofisto Guingona III,Liberal,Majority,5.0,2,735.0,True,8,3.0,True,True,114
4270,16SBN-1186,SBN-1186,16,"an act to postpone the sangguniang kabataan elections on october 28, 2013, amending for the purpose section 1 of republic act no. 9340, and for other purposes",2013-07-30,National,Approved by the President of the Philippines,"Marcos, Ferdinand ""Bongbong"" R., Villar, Cynthia A.",2013-10-03,True,Bongbong Marcos,Nacionalista,Majority,3.0,2,65.0,False,7,3.0,True,True,158
4386,16SBN-1070,SBN-1070,16,"an act creating a ‘people’s fund’, earmarking all proceeds from the value-added tax to the said fund, for the exclusive allocation to the education and health needs of our people, amending for this purpose the national internal revenue code, as amended",2013-07-23,National,Sent to the Archives,"Ejercito-Estrada, Jinggoy P.",2014-10-20,False,Jinggoy Ejercito-Estrada,PMP,Minority,10.0,1,454.0,True,7,3.0,True,False,252
4422,16SBN-1034,SBN-1034,16,"an act mandating the department of environment and natural resources, through the national mapping and resource information authority, to identify the low-lying areas of the philippine territory, vulnerable to rising sea levels as result of global warming",2013-07-22,National,Sent to the Archives,"Defensor Santiago, Miriam",2015-12-08,False,Miriam Santiago,PRP,Majority,20.0,1,869.0,True,7,3.0,True,True,255
4542,16SBN-914,SBN-914,16,"an act to regulate and modernize the practice of chemistry in the philippines, repealing for the purpose republic act no. 754 entitled ‘an act to regulate the practice of chemistry in the philippines’, and for other purposes",2013-07-18,National,Consolidated with Approved Bill,"Trillanes, Antonio ""Sonny"" F., Villar, Cynthia A.",2015-03-27,True,Antonio Trillanes IV,Nacionalista,Majority,8.0,2,617.0,True,7,3.0,True,True,224
4580,16SBN-876,SBN-876,16,"an act restoring to congress the power to appropriate payments on debt service, reviving for the purpose section 6 of republic act no. 4860 (foreign borrowing act), and repealing section 7 of presidential decree no. 81, section 31 of presidential decree no. 1177 and sections 1, 2 and 3 of presidential decree no. 1967",2013-07-17,National,Sent to the Archives,"Ejercito-Estrada, Jinggoy P.",2015-07-28,False,Jinggoy Ejercito-Estrada,PMP,Minority,11.0,1,741.0,True,7,3.0,True,False,318
4612,16SBN-844,SBN-844,16,"an act creating a ‘people’s fund’, earmarking all proceeds from the value-added tax to the said fund, for the exclusive allocation to the education and health needs of our people, amending for this purpose the national internal revenue code, as amended",2013-07-17,National,Sent to the Archives,"Ejercito, Joseph Victor G.",2014-10-20,False,JV Ejercito,PMP,Minority,1.0,1,460.0,True,7,3.0,True,False,252
